{
  "year": 2026,
  "community": "Orchards at Greentree",
  "township": "Evesham Township, NJ",
  "website": "https://portal.targetpm.com/public",
  "source": "Evesham Township 2026 Holiday Trash, Recycling & Bulk Collection Schedules",
  "regularTrashDay": "Thursday",
  "setOutHour": 18,
  "recyclingUrl": "https://www.burlingtoncountynj.gov/345/Recycling",
  "trash": [
    {
      "date": "2026-01-02",
      "note": "Moved to Friday for New Year's Day"
    },
    {
      "date": "2026-01-08"
    },
    {
      "date": "2026-01-15"
    },
    {
      "date": "2026-01-23",
      "note": "Moved to Friday for Martin Luther King Jr. Day"
    },
    {
      "date": "2026-01-29"
    },
    {
      "date": "2026-02-05"
    },
    {
      "date": "2026-02-12"
    },
    {
      "date": "2026-02-20",
      "note": "Moved to Friday for Presidents' Day"
    },
    {
      "date": "2026-02-26"
    },
    {
      "date": "2026-03-05"
    },
    {
      "date": "2026-03-12"
    },
    {
      "date": "2026-03-19"
    },
    {
      "date": "2026-03-26"
    },
    {
      "date": "2026-04-02"
    },
    {
      "date": "2026-04-10",
      "note": "Moved to Friday for Easter Monday"
    },
    {
      "date": "2026-04-16"
    },
    {
      "date": "2026-04-23"
    },
    {
      "date": "2026-04-30"
    },
    {
      "date": "2026-05-07"
    },
    {
      "date": "2026-05-14"
    },
    {
      "date": "2026-05-21"
    },
    {
      "date": "2026-05-29",
      "note": "Moved to Friday for Memorial Day"
    },
    {
      "date": "2026-06-04"
    },
    {
      "date": "2026-06-11"
    },
    {
      "date": "2026-06-18"
    },
    {
      "date": "2026-06-25"
    },
    {
      "date": "2026-07-02"
    },
    {
      "date": "2026-07-09"
    },
    {
      "date": "2026-07-16"
    },
    {
      "date": "2026-07-23"
    },
    {
      "date": "2026-07-30"
    },
    {
      "date": "2026-08-06"
    },
    {
      "date": "2026-08-13"
    },
    {
      "date": "2026-08-20"
    },
    {
      "date": "2026-08-27"
    },
    {
      "date": "2026-09-03"
    },
    {
      "date": "2026-09-11",
      "note": "Moved to Friday for Labor Day"
    },
    {
      "date": "2026-09-17"
    },
    {
      "date": "2026-09-24"
    },
    {
      "date": "2026-10-01"
    },
    {
      "date": "2026-10-08"
    },
    {
      "date": "2026-10-16",
      "note": "Moved to Friday for Columbus Day"
    },
    {
      "date": "2026-10-22"
    },
    {
      "date": "2026-10-29"
    },
    {
      "date": "2026-11-05"
    },
    {
      "date": "2026-11-13",
      "note": "Moved to Friday for Veterans Day"
    },
    {
      "date": "2026-11-19"
    },
    {
      "date": "2026-11-28",
      "note": "Moved to Saturday for Thanksgiving"
    },
    {
      "date": "2026-12-03"
    },
    {
      "date": "2026-12-10"
    },
    {
      "date": "2026-12-17"
    },
    {
      "date": "2026-12-24"
    },
    {
      "date": "2026-12-31"
    }
  ],
  "recycling": [
    {
      "date": "2026-01-09"
    },
    {
      "date": "2026-01-23"
    },
    {
      "date": "2026-02-06"
    },
    {
      "date": "2026-02-20"
    },
    {
      "date": "2026-03-06"
    },
    {
      "date": "2026-03-20"
    },
    {
      "date": "2026-04-03",
      "note": "Collected on Good Friday as scheduled"
    },
    {
      "date": "2026-04-17"
    },
    {
      "date": "2026-05-01"
    },
    {
      "date": "2026-05-15"
    },
    {
      "date": "2026-05-30",
      "note": "Saturday pickup (Memorial Day week)"
    },
    {
      "date": "2026-06-12"
    },
    {
      "date": "2026-06-26"
    },
    {
      "date": "2026-07-10"
    },
    {
      "date": "2026-07-24"
    },
    {
      "date": "2026-08-07"
    },
    {
      "date": "2026-08-21"
    },
    {
      "date": "2026-09-04"
    },
    {
      "date": "2026-09-18"
    },
    {
      "date": "2026-10-02"
    },
    {
      "date": "2026-10-16"
    },
    {
      "date": "2026-10-30"
    },
    {
      "date": "2026-11-13"
    },
    {
      "date": "2026-11-28",
      "note": "Saturday pickup (Thanksgiving week)"
    },
    {
      "date": "2026-12-11"
    },
    {
      "date": "2026-12-26",
      "note": "Saturday pickup (Christmas week)"
    }
  ],
  "bulk": [
    {
      "zones": "3-4",
      "curbsideBy": "2026-01-12",
      "windowStart": "2026-01-12",
      "windowEnd": "2026-01-16"
    },
    {
      "zones": "3-4",
      "curbsideBy": "2026-04-13",
      "windowStart": "2026-04-13",
      "windowEnd": "2026-04-17"
    },
    {
      "zones": "3-4",
      "curbsideBy": "2026-07-13",
      "windowStart": "2026-07-13",
      "windowEnd": "2026-07-17"
    },
    {
      "zones": "3-4",
      "curbsideBy": "2026-10-12",
      "windowStart": "2026-10-13",
      "windowEnd": "2026-10-16"
    }
  ]
}